{
  "schema_version": 1,
  "fixture_id": "calibration-specification-violation",
  "public_fixture_sha256": "76a0c69522e40116f3c3436ab34ec8aee6a31f651e42c245d45d60449e982408",
  "claims": [
    {
      "verdict": "invalid",
      "seeded_defect_description": "The candidate uses code-point ordering rather than required case-insensitive ordering.",
      "reproduction_procedure": [
        {
          "argv": [
            "python3",
            "-m",
            "unittest",
            "discover",
            "-s",
            "tests",
            "-v"
          ]
        }
      ],
      "expected_evidence": [
        "The mixed-case three-name ordering assertion fails."
      ],
      "ambiguity": "none",
      "difficulty": {
        "tier": "moderate",
        "expected_validation_seconds": 90,
        "skill_tags": [
          "specification",
          "python"
        ]
      },
      "claim_id": "claim/candidate-satisfies-specification"
    }
  ]
}
