{
  "schema_version": 1,
  "fixture_id": "smoke-subtle-regression",
  "public_fixture_sha256": "8b28de0678057c3312a4efba175fa28f432c0dc34073ec840ab0c352682703e8",
  "claims": [
    {
      "verdict": "invalid",
      "seeded_defect_description": "The inclusive boundary was changed to an exclusive comparison.",
      "reproduction_procedure": [
        {
          "argv": [
            "python3",
            "-m",
            "unittest",
            "discover",
            "-s",
            "tests",
            "-v"
          ]
        }
      ],
      "expected_evidence": [
        "The equality boundary assertion fails."
      ],
      "ambiguity": "none",
      "difficulty": {
        "tier": "subtle",
        "expected_validation_seconds": 180,
        "skill_tags": [
          "boundary-analysis",
          "python"
        ]
      },
      "claim_id": "claim/candidate-satisfies-specification"
    }
  ]
}
