{
  "schema_version": 1,
  "fixture_id": "smoke-genuinely-ambiguous-claim",
  "public_fixture_sha256": "45793f0791901916a65f840c260ed0abb215714a7f8db119b0499b26dc49c059",
  "claims": [
    {
      "verdict": "ambiguous",
      "seeded_defect_description": null,
      "reproduction_procedure": [
        {
          "argv": [
            "python3",
            "-m",
            "unittest",
            "discover",
            "-s",
            "tests",
            "-v"
          ]
        }
      ],
      "expected_evidence": [
        "All specified non-empty behavior passes; the changed empty-input behavior is outside the written contract."
      ],
      "ambiguity": "specification_incomplete",
      "difficulty": {
        "tier": "expert",
        "expected_validation_seconds": 240,
        "skill_tags": [
          "ambiguity",
          "specification"
        ]
      },
      "claim_id": "claim/candidate-satisfies-specification"
    }
  ]
}
