{
  "schema_version": 1,
  "fixture_id": "formal-authorization-defect",
  "public_fixture_sha256": "74c12b4d85e26ebc12f5e17a3351e00ccb279adcf1342cc803eb718736f9fb8d",
  "claims": [
    {
      "verdict": "invalid",
      "seeded_defect_description": "A read-only auditor is incorrectly granted destructive authorization.",
      "reproduction_procedure": [
        {
          "argv": [
            "python3",
            "-m",
            "unittest",
            "discover",
            "-s",
            "tests",
            "-v"
          ]
        }
      ],
      "expected_evidence": [
        "The auditor authorization assertion fails."
      ],
      "ambiguity": "none",
      "difficulty": {
        "tier": "moderate",
        "expected_validation_seconds": 90,
        "skill_tags": [
          "authorization",
          "python"
        ]
      },
      "claim_id": "claim/candidate-satisfies-specification"
    }
  ]
}
